{
  "receipt_id": "sig-004",
  "surface": "signal",
  "lane": "notify",
  "actor_or_agent": "claude-code",
  "recipient_alias": "all-agents",
  "group_alias": "fleet-broadcast",
  "event_class": "broadcast",
  "risk_class": "forbidden",
  "message_hash": "d4e5f6789012345678901234567890abcdef1234567890abcdef1234567890123456",
  "message_summary": "Broadcast without explicit lane policy — denied",
  "admission_decision": "denied",
  "executor": null,
  "transport_mode": "dry_run",
  "sent_timestamp": null,
  "received_timestamp": null,
  "durable_uri": "receipts/signal/sig-004.json",
  "redactions_applied": []
}
