{
  "receipt_id": "sig-006",
  "surface": "signal",
  "lane": "notify",
  "actor_or_agent": "claude-code",
  "recipient_alias": "operator",
  "group_alias": null,
  "event_class": "health_summary",
  "risk_class": "notify_read_only",
  "message_hash": "f6789012345678901234567890abcdef1234567890abcdef1234567890123456789012",
  "message_summary": "Health summary with [REDACTED:api_key] and [REDACTED:hostname] removed",
  "admission_decision": "admitted",
  "executor": "signal-cli",
  "transport_mode": "json_rpc",
  "sent_timestamp": "2026-06-29T12:10:00Z",
  "received_timestamp": null,
  "durable_uri": "receipts/signal/sig-006.json",
  "redactions_applied": ["api_key", "hostname"]
}
