{
  "receipt_id": "sig-001",
  "surface": "signal",
  "lane": "notify",
  "actor_or_agent": "claude-code",
  "recipient_alias": "operator",
  "group_alias": null,
  "event_class": "health_summary",
  "risk_class": "notify_read_only",
  "message_hash": "a1b2c3d4e5f6789012345678901234567890abcdef1234567890abcdef12345678",
  "message_summary": "Morning briefing completed: 3 PRs merged, 0 CI failures",
  "admission_decision": "admitted",
  "executor": "signal-cli",
  "transport_mode": "json_rpc",
  "sent_timestamp": "2026-06-29T12:00:00Z",
  "received_timestamp": null,
  "durable_uri": "receipts/signal/sig-001.json",
  "redactions_applied": []
}
